title,author,publisher,URL,ISBN,date,isAvailable,isSubscribed
The Little Prince,Antoine de Saint-Exupéry,UBC Blogs,https://blogs.ubc.ca/edcp508/files/2016/02/TheLittlePrince.pdf,978-3159621791,1943-04-06,true,true
Design Patterns: Elements of Reusable Object-Oriented Software,Erich Gamma; Richard Helm; Ralph Johnson and John Vlissides,Addison-Wesley, DesignPatternsPotentialUrl,978-0201633610,1994-10-31,true,false
UML Distilled: A Brief Guide to the Standard Object-Modeling Language,Martin Fowler,Addison-Wesley,UMLDistilledPotentialUrl.pdf,978-0321193681,2003-09-15,false,true
Domain Driven Design: Tackling Complexity in The Heart of Software,Eric Evans,Addison-Wesley,DomainDrivenDesignPotentialUrl.pdf,978-0321125217,2003-08-22,false,false
Clean Architecture: A Craftsman's Guide to Software Structure and Design Paperback,Robert Martin,Pearson,CleanArchitecturePotentialUrl.pdf,978-0134494166, 2017-09-10,true,true
